Authors,Author full names,Author(s) ID,Title,Year,Source title,Volume,Issue,Art. No.,Page start,Page end,Cited by,DOI,Link,Abstract,Author Keywords,Index Keywords,Document Type,Publication Stage,Open Access,Source,EID,Country
Bhatt S.; Goenka N.; Kalra S.; Sharma Y.,"Bhatt, Shaily (57274293700); Goenka, Naman (57271225200); Kalra, Sakshi (57223096413); Sharma, Yashvardhan (22981757500)",57274293700; 57271225200; 57223096413; 22981757500,Fake News Detection: Experiments and Approaches Beyond Linguistic Features,2022,Lecture Notes on Data Engineering and Communications Technologies,71,,,113.0,128.0,21,10.1007/978-981-16-2937-2_9,https://www.scopus.com/pages/publications/85115675065?origin=resultslist,"Easier access to the Internet and social media has made disseminating information through online sources very easy. Sources like Facebook, Twitter, online news sites and blogs of self-proclaimed journalists have become significant players in providing news content. The sheer amount of information and the speed at which it is generated online makes it beyond the scope of human verification. There is, hence, a pressing need to develop technologies that can assist humans with automatic fact-checking and reliable identification of fake news. This paper summarises the multiple approaches that were undertaken and the experiments that were carried out for the task. Credibility information and metadata associated with the news article have been used for improved results. The experiments also show how modelling justification or evidence can lead to improved results. Additionally, the use of visual features in addition to linguistic features is demonstrated. A detailed comparison of the results showing that our models perform significantly well when compared to robust baselines, and state-of-the-art models are presented. © 2022, The Author(s), under exclusive license to Springer Nature Singapore Pte Ltd.",BERT; CNN; Credibility index; Fake news detection; Fake news net; Justification modelling; LIAR; LSTM; Metadata; Multimodal fake news detection; RNN; Siamese networks,Information dissemination; Linguistics; Long short-term memory; Metadata; BERT; CNN; Credibility indices; Fake news detection; Fake news net; Justification modeling; LIAR; LSTM; Multi-modal; Multimodal fake news detection; RNN; Siamese network; Social networking (online),Book chapter,Final,All Open Access; Green Open Access,Scopus,2-s2.0-85115675065,Unknown
Folino F.; Folino G.; Guarascio M.; Pontieri L.; Zicari P.,"Folino, Francesco (23666966800); Folino, Gianluigi (6601965569); Guarascio, Massimo (55900121400); Pontieri, Luigi (6602455538); Zicari, Paolo (8409523900)",23666966800; 6601965569; 55900121400; 6602455538; 8409523900,Towards Data- and Compute-Efficient Fake-News Detection: An Approach Combining Active Learning and Pre-Trained Language Models,2024,SN Computer Science,5,5,470,,,13,10.1007/s42979-024-02809-1,https://www.scopus.com/pages/publications/85191094955?origin=resultslist,"In today’s digital era, dominated by social media platforms such as Twitter, Facebook, and Instagram, the swift dissemination of misinformation represents a significant concern, impacting public sentiment and influencing pivotal global events. Promptly detecting such deceptive content with the help of Machine Learning models is crucial, yet it comes with the challenge of dealing with labelled examples for training these models. Impressive performance results were recently achieved by high-capacity pre-trained transformer-based models (e.g., BERT). Still, such models are too data- and compute-demanding for many critical application contexts where memory, time, and energy consumption must be limited. Here, we propose an innovative semi-supervised method for efficient and effective fake news detection using a content-oriented classifier based on a small-sized BERT embedder. After fine-tuning this model on the sole few labelled data available, an iterative Active Learning (AL) process is carried out, which benefits from limited experts’ feedback to acquire more labelled data for improving the model. The proposed method ensures good detection performances using a few training samples, reasonably small human intervention, and compute/memory costs. © The Author(s) 2024.",Active learning; Deep learning; Fake news detection; Green AI,,Article,Final,All Open Access; Hybrid Gold Open Access,Scopus,2-s2.0-85191094955,Unknown
Deng Y.; Wang S.-W.,"Deng, Yawen (57931388100); Wang, Sheng-Wen (57930950200)",57931388100; 57930950200,Detecting Fake News on Social Media by CSIBERT,2022,ACM International Conference Proceeding Series,,,,142.0,148.0,3,10.1145/3556677.3556698,https://www.scopus.com/pages/publications/85139993618?origin=resultslist,"Social media has become a significant news source as the modern world develops. Compared with traditional news media such as newspapers and television, people can consume and share news much faster on social media platforms such as Twitter, Facebook, and Weibo. These platforms are not regulated, which leads to massive amounts of fake news produced online and causes severe negative impacts on politics, economics, and social well-being. Thus, detecting fake news on social media is extremely important but technically challenging. This paper proposes a hybrid fake news detection model called CSIBERT, extracting text features of news events utilizing a Bidirectional Encoder Representations from Transformers (BERT) pre-trained model and introducing other social context features via the Capture, Score, and Integrate (CSI) framework. Our proposed model outperforms existing models with an accuracy of 97.1%. In addition, the CSIBERT model receives decent performance even with a small number of labeled samples on the Weibo fake news detection tasks, demonstrating its ability to solve the label shortage problem in fake news detection challenges.  © 2022 ACM.",BERT; CSI; Deep learning; Fake news; Natural Language Processing; Social media,"Fake detection; Natural language processing systems; Social networking (online); Bidirectional encoder representation from transformer; Capture, score, and integrate; Deep learning; Fake news; Language processing; Natural language processing; Natural languages; News media; News sources; Social media; Deep learning",Conference paper,Final,,Scopus,2-s2.0-85139993618,Unknown
Palani B.; Elango S.; Vignesh Viswanathan K.,"Palani, Balasubramanian (57387945500); Elango, Sivasankar (36164914500); Vignesh Viswanathan, K. (57460522200)",57387945500; 36164914500; 57460522200,CB-Fake: A multimodal deep learning framework for automatic fake news detection using capsule neural network and BERT,2022,Multimedia Tools and Applications,81,4,,5587.0,5620.0,143,10.1007/s11042-021-11782-3,https://www.scopus.com/pages/publications/85121859108?origin=resultslist,"The progressive growth of today’s digital world has made news spread exponentially faster on social media platforms like Twitter, Facebook, and Weibo. Unverified news is often disseminated in the form of multimedia content like text, picture, audio, or video. The dissemination of such false news deceives the public and leads to protests and creates troubles for the public and the government. Hence, it is essential to verify the authenticity of the news at an early stage before sharing it with the public. Earlier fake news detection (FND) approaches combined textual and visual features, but the semantic correlations between words were not addressed and many informative visual features were lost. To address this issue, an automated fake news detection system is proposed, which fuses textual and visual features to create a multimodal feature vector with high information content. The proposed work incorporates the bidirectional encoder representations from transformers (BERT) model to extract the textual features, which preserves the semantic relationships between words. Unlike the convolutional neural network (CNN), the proposed capsule neural network (CapsNet) model captures the most informative visual features from an image. These features are combined to obtain a richer data representation that helps to determine whether the news is fake or real. We investigated the performance of our model against different baselines using two publicly accessible datasets, Politifact and Gossipcop. Our proposed model achieves significantly better classification accuracy of 93% and 92% for the Politifact and Gossipcop datasets, respectively, compared to 84.6% and 85.6% for the SpotFake+ model. © 2021, The Author(s), under exclusive licence to Springer Science+Business Media, LLC, part of Springer Nature.",BERT; Capsule neural network; Deep learning; Fake news detection; Routing-by-agreement,Classification (of information); Convolutional neural networks; Deep learning; Fake detection; Feature extraction; Semantics; Bidirectional encoder representation from transformer; Capsule neural network; Deep learning; Fake news detection; Multi-modal; Neural-networks; Routing-by-agreement; Routings; Textual features; Visual feature; Social networking (online),Article,Final,All Open Access; Bronze Open Access; Green Open Access,Scopus,2-s2.0-85121859108,Unknown
Rane R.; Subhashini R.,"Rane, Rashmi (57191090200); Subhashini, R. (36601503200)",57191090200; 36601503200,Multi-feature classification for fake news detection using multiscale and atrous convolution-based adaptive temporal convolution network,2025,Data and Knowledge Engineering,160,,102469,,,2,10.1016/j.datak.2025.102469,https://www.scopus.com/pages/publications/105007736730?origin=resultslist,"In the exponential growth of social media platforms, Facebook, Twitter, YouTube and Instagram are the main sources for providing news and information about anything at anywhere. Sometimes, fake information is quickly spread by uploading from particular people affecting the media usage of people. In this research work, a novel deep learning-based framework is proposed to effectively detect fake news for enhancing the trust of social media users. At first, the required text data is gathered from the benchmark resources and given to the preprocessing stage. Then, the preprocessed data is fed into the feature extraction phase here, the Bidirectional Encoder Representations from Transformers (BERT), Recurrent Neural Networks (RNN), and Convolutional Neural Networks (CNN) mechanisms are utilized to effectively extract the meaningful information from the data and improve the accuracy. Also, it can generate three sets of BERT, temporal, and spatial features in the extraction phase and then given to the detection phase. Here, the Multiscale and Atrous Convolution-based Adaptive Temporal Convolution Network (MAC-ATCN) is used for ultimately identifying and categorizing the false information to ensure more reliable outcomes and decision-making processes. Additionally, the Modified Osprey Optimization Algorithm (MOOA) algorithm is employed to fine-tune the parameters to prevent overfitting issues when dealing with larger data. It helps to easily address the imbalanced dataset issues by varying the hyperparameters in the training process. Finally, the overall detection performance is validated with various performance measures and compared with existing works. Also, the developed method achieved better accuracy value for dataset 1 is 93.74 % and dataset 2 is 92.82%. By effectively identifying the fake news in social media can help users to make timely informed decisions. This helps to prevent the spread of misinformation and protects individuals from harmful consequences. © 2025 Elsevier B.V.",Bidirectional encoder representations from transformers; Convolution neural network; Fake news detection; Modified osprey optimization algorithm; Multiscale and atrous convolution-based adaptive temporal convolution network; Recurrent neural network,Convolutional neural networks; Tweets; Bidirectional encoder representation from transformer; Convolution neural network; Extraction phase; Fake news detection; Modified osprey optimization algorithm; Multifeatures; Multiscale and atrous convolution-based adaptive temporal convolution network; Neural-networks; Optimization algorithms; Social media; Recurrent neural networks,Article,Final,,Scopus,2-s2.0-105007736730,Unknown
Shah M.N.; Ganatra A.,"Shah, Minal Nirav (57966254500); Ganatra, Amit (35100186600)",57966254500; 35100186600,Feature Integration-based Residual Deep Learning Model for Fake News Detection using Multimodal Data Sources,2024,"2nd International Conference on Self Sustainable Artificial Intelligence Systems, ICSSAS 2024 - Proceedings",,,,345.0,353.0,1,10.1109/ICSSAS64001.2024.10760251,https://www.scopus.com/pages/publications/85213404867?origin=resultslist,"The rapid growth of the modern digital world has supported to spread the news rapidly on the social media sectors including Weibo, Facebook, and Twitter. Unconfirmed news is frequently spread in multimedia content form such as video, audio, picture, or text. The propagation of certain false news cheats the public results in protests and generates issues. Fake news propagation has become a significant issue in modern data because of the huge utilization of social media entities. One of the important operations is false news identification, yet the difficulty of some languages makes the identification of fake news complex. The conventional approaches cannot gather many contextual and semantic features from the documents in a specific multilingual text corpus. To overcome such issues, a residual-based deep learning model is introduced for fake news detection using multimodal information. Firstly, multimodal information like text and images are gathered from publicly available data sources. Further, the input text is undergone for pre-processing and it is used for extracting the features. Here, the Bidirectional Encoder Representations from Transformers (BERT) is employed as feature extraction as F1. Similarly, the features from the raw image are achieved by applying the Visual Geometry Group (VGG16), designated as F2. Finally, these two resultant features are concatenated together and subjected to the Residual Recurrent Neural Network (Res-RNN) for detecting fake news. Hence, the proposed system is examined with different metrics and compared with various approaches. Thus, the results declare that the suggested system achieves higher accuracy in avoiding the spreading of fake news over the media. © 2024 IEEE.",Bidirectional Encoder Representations from Transformer; Feature Integration; Multimodal Fake News Detection; Residual Recurrent Neural Network; Visual Geometry Group16,Tweets; Bidirectional encoder representation from transformer; Data-source; Feature integration; Learning models; Multi-modal; Multi-modal information; Multimodal fake news detection; Neural-networks; Social media; Visual geometry group16; Recurrent neural networks,Conference paper,Final,,Scopus,2-s2.0-85213404867,Unknown
Osama Md.; Ahmed K.; Taher H.M.A.; Hossain J.; Ahsan S.; Hoque M.M.,"Osama, Md. (58886980000); Ahmed, Kawsar (58886851700); Taher, Hasan Mesbaul Ali (58886889100); Hossain, Jawad (58886821900); Ahsan, Shawly (58930269300); Hoque, Mohammed Moshiul (55436576000)",58886980000; 58886851700; 58886889100; 58886821900; 58930269300; 55436576000,CUET_NLP_GoodFellows@DravidianLangTech EACL2024: A Transformer-Based Approach for Detecting Fake News in Dravidian Languages,2024,"DravidianLangTech 2024 - 4th Workshop on Speech, Vision, and Language Technologies for Dravidian Languages, Proceedings of the Workshop",,,,187.0,192.0,5,,https://www.scopus.com/pages/publications/85189858974?origin=resultslist,"In this modern era, many people have been using Facebook and Twitter, leading to increased information sharing and communication. However, a considerable amount of information on these platforms is misleading or intentionally crafted to deceive users, which is often termed as fake news. A shared task on fake news detection in Malayalam organized by DravidianLangTech@EACL 2024 allowed us for addressing the challenge of distinguishing between original and fake news content in the Malayalam language. Our approach involves creating an intelligent framework to categorize text as either fake or original. We experimented with various machine learning models, including Logistic Regression, Decision Tree, Random Forest, Multinomial Naive Bayes, SVM, and SGD, and various deep learning models, including CNN, BiLSTM, and BiLSTM + Attention. We also explored Indic-BERT, MuRIL, XLM-R, and m-BERT for transformer-based approaches. Notably, our most successful model, m-BERT, achieved a macro F1 score of 0.85 and ranked 4th in the shared task. This research contributes to combating misinformation on social media news, offering an effective solution to classify content accurately. © 2024 Association for Computational Linguistics.",,Computational linguistics; Deep learning; Fake detection; Learning systems; Logistic regression; Random forests; Social networking (online); Support vector regression; Amount of information; Facebook; Information communication; Information sharing; Logistics regressions; Machine learning models; Malayalams; Multinomial naive bayes; News content; Random forests; Decision trees,Conference paper,Final,,Scopus,2-s2.0-85189858974,Unknown
Malla S.J.; Alphonse P.J.A.,"Malla, SreeJagadeesh (57220890140); Alphonse, P.J.A. (57200760920)",57220890140; 57200760920,Fake or real news about COVID-19? Pretrained transformer model to detect potential misleading news,2022,European Physical Journal: Special Topics,231,18-20,,3347.0,3356.0,36,10.1140/epjs/s11734-022-00436-6,https://www.scopus.com/pages/publications/85123059903?origin=resultslist,"The World Health Organization declared the novel coronavirus disease 2019 a pandemic on March 11, 2020. Along with the coronavirus pandemic, a new crisis has emerged, characterized by widespread fear and panic caused by a lack of information or, in some cases, outright fake messages. In these circumstances, Twitter is one of the most eminent and trusted social media platforms. Fake tweets, on the other hand, are challenging to detect and differentiate. The primary goal of this paper is to educate society about the importance of accurate information and prevent the spread of fake information. This paper has investigated COVID-19 fake data from various social media platforms such as Twitter, Facebook, and Instagram. The objective of this paper is to categorize given tweets as either fake or real news. The authors have tested various deep learning models on the COVID-19 fake dataset. Finally, the CT-BERT and RoBERTa deep learning models outperformed other deep learning models like BERT, BERTweet, AlBERT, and DistlBERT. The proposed ensemble deep learning architecture outperformed CT-BERT and RoBERTa on the COVID-19 fake news dataset using the multiplicative fusion technique. The proposed model’s performance in this technique was determined by the multiplicative product of the final predictive values of CT-BERT and RoBERTa. This technique overcomes the disadvantage of these CT-BERT and RoBERTa models’ incorrect predictive nature. The proposed architecture outperforms both well-known ML and DL models, with 98.88% accuracy and a 98.93% F1-score. © 2022, The Author(s), under exclusive licence to EDP Sciences, Springer-Verlag GmbH Germany, part of Springer Nature.",,,Article,Final,All Open Access; Bronze Open Access; Green Open Access,Scopus,2-s2.0-85123059903,Unknown
Yang H.; Zhao X.; Sun D.; Wang Y.; Zhu H.; Ma C.; Huang W.,"Yang, Haitian (57222572285); Zhao, Xuan (57222575825); Sun, Degang (56419137200); Wang, Yan (56368700100); Zhu, He (57223750361); Ma, Chao (57222580681); Huang, Weiqing (56419055500)",57222572285; 57222575825; 56419137200; 56368700100; 57223750361; 57222580681; 56419055500,Multi-Modal fake news Detection on Social Media with Dual Attention Fusion Networks,2021,Proceedings - IEEE Symposium on Computers and Communications,2021-September,,,,,6,10.1109/ISCC53001.2021.9631256,https://www.scopus.com/pages/publications/85123217353?origin=resultslist,"Most of the existed fake news detection works on social media driven-fake news mainly focused on text. However, more and more social media platforms like Twitter, facebook, etc, allow users to create multi-modal contents, including text, image and video. Hence, it is obvious that only investigating text contents is insufficient to achieve solid detection. In this paper, we study the fake news on social media platforms composed of multimodal contents (text and images), and propose Dual Attention Fusion Networks for fake news detection on social media. We explore three modalities, (text modality, image modality and image attributes modality), and further propose a Dual Attention Fusion Networks (DAFN) model for this task. First, our proposed model extracts text modality and image modality, respectively. We then pass combinations of image attributes modality and text modality through BERT to extract text features. Finally, we reconstruct features of three modalities and fuse them into a feature vector for prediction. Our method is verified on realworld datasets consisting of collected social media platforms. Experiments show that the our method achieves promising results on real world datasets. outperforming all baseline models.  © 2021 IEEE.",attention fusion; fake news detection; multi-modal; sentiment analysis,Fake detection; Image fusion; Sentiment analysis; Attention fusion; Facebook; Fake news detection; Image attributes; Image modality; Multi-modal; Real-world datasets; Sentiment analysis; Social media; Social media platforms; Social networking (online),Conference paper,Final,,Scopus,2-s2.0-85123217353,Unknown
Qasem A.E.; Sajid M.,"Qasem, Amal Esmail (58126219200); Sajid, Mohammad (55608655900)",58126219200; 55608655900,Exploring the Effect of N-grams with BOW and TF-IDF Representations on Detecting Fake News,2022,"2022 International Conference on Data Analytics for Business and Industry, ICDABI 2022",,,,741.0,746.0,5,10.1109/ICDABI56818.2022.10041537,https://www.scopus.com/pages/publications/85149268786?origin=resultslist,"The Internet is used by millions of users daily, who publish news content on social media like (Twitter, Facebook, etc.). These platforms are becoming the most significant source of spreading fake news, which plays a significant issue for the individual and society. Fake news is incorrect information written to mislead readers. Fake news' text available on these platforms is unstructured and needs to be preprocessed and converted to a numerical format to be used later. Some fake news has seemed natural, making it challenging even for humans to identify them. Therefore, automated fake news detection tools leveraging machine learning methods have become an essential requirement. This paper investigates and compares two feature extraction approaches, Bag of Words (BoW) and Term Frequency-Inverse Document Frequency (TF-IDF), with N-grams, and three conventional machine classifiers, Support Vector Machine (SVM), Naive Bayes (NB), and Decision Tree (DT). In addition, the performance of these models is compared with the fine-tuned BERT transformer model with its feature representation. The experiment was conducted on fake and real news dataset. It is demonstrated that the traditional models are still good candidates and that the use of bigram combined with BOW and DT classifier performs the best among others, with an accuracy of 99.74% compared to existing results and reaching BERT f1-accuracy on this dataset. © 2022 IEEE.",BERT; Fake classification; Fake Detection; Fake News; Machine learning; N-grams,Decision trees; Fake detection; Feature extraction; Learning systems; Social networking (online); Support vector machines; Text processing; BERT; Facebook; Fake classification; Fake detection; Fake news; Machine-learning; N-grams; News content; Social media; Term frequencyinverse document frequency (TF-IDF); Classification (of information),Conference paper,Final,,Scopus,2-s2.0-85149268786,Unknown
